{
  "id": "sample-observability",
  "name": "Sample Observability Plugin",
  "version": "0.1.0",
  "apiVersion": "1.0.0",
  "capabilities": [
    "dashboard.widget",
    "validator",
    "event.handler"
  ],
  "permissions": [
    "read_events",
    "register_validator",
    "register_event_handler"
  ],
  "entrypoints": {
    "backend": "backend_hook.py",
    "frontend": "sampleFrontendWidget"
  }
}
